news_headline,news_article,news_category,full_text,clean_text
Trump was involved in talks to pay pornstar to hide affair: FBI,"US President Donald Trump was directly involved in the talks to pay pornstar Stormy Daniels to hide their alleged affair, the FBI has said. Trump's then-campaign Press Secretary Hope Hicks was also involved in the talks. Daniels had claimed that she was paid $130,000 by Trump's former lawyer Michael Cohen during the 2016 election campaign to maintain her silence. ",world,"Trump was involved in talks to pay pornstar to hide affair: FBI. US President Donald Trump was directly involved in the talks to pay pornstar Stormy Daniels to hide their alleged affair, the FBI has said. Trump's then-campaign Press Secretary Hope Hicks was also involved in the talks. Daniels had claimed that she was paid $130,000 by Trump's former lawyer Michael Cohen during the 2016 election campaign to maintain her silence. ",trump involve talk pay pornstar hide affair fbi us president donald trump directly involve talk pay pornstar stormy daniel hide allege affair fbi say trump campaign press secretary hope hick also involve talk daniel claim pay trump former lawyer michael cohen election campaign maintain silence
US Navy shoots down Iranian drone in Strait of Hormuz,"US President Donald Trump on Thursday said that a US Navy ship had ""destroyed"" an Iranian drone in the Strait of Hormuz after the aircraft threatened the vessel. He added that the drone had flown to within 1,000 yards of the ship and had ignored ""multiple calls to stand down"". Iran in June shot down a US military surveillance drone.",world,"US Navy shoots down Iranian drone in Strait of Hormuz. US President Donald Trump on Thursday said that a US Navy ship had ""destroyed"" an Iranian drone in the Strait of Hormuz after the aircraft threatened the vessel. He added that the drone had flown to within 1,000 yards of the ship and had ignored ""multiple calls to stand down"". Iran in June shot down a US military surveillance drone.",us navy shoot iranian drone strait hormuz us president donald trump thursday say us navy ship destroy iranian drone strait hormuz aircraft threaten vessel add drone fly within yard ship ignore multiple call stand iran june shoot us military surveillance drone
"Haven't lost any drone, US shot down its own by mistake: Iran","Iranian Deputy Foreign Minister Abbas Araghchi has denied US claims that it had shot down an Iranian drone in the Strait of Hormuz. ""We have not lost any drone...[I am worried that US shot down its own drone] by mistake,"" Araghchi said. US President Donald Trump had said the drone had flown to within 1,000 yards of the USS Boxer.",world,"Haven't lost any drone, US shot down its own by mistake: Iran. Iranian Deputy Foreign Minister Abbas Araghchi has denied US claims that it had shot down an Iranian drone in the Strait of Hormuz. ""We have not lost any drone...[I am worried that US shot down its own drone] by mistake,"" Araghchi said. US President Donald Trump had said the drone had flown to within 1,000 yards of the USS Boxer.",not lose drone us shoot mistake iran iranian deputy foreign minister abba araghchi deny us claim shoot iranian drone strait hormuz not lose drone [ worried us shoot drone ] mistake araghchi say us president donald trump say drone fly within yard uss boxer
Benjamin Netanyahu becomes longest-serving Israeli PM,"Benjamin Netanyahu has become Israel's longest-serving Prime Minister, surpassing the record set by the country's founding father and first leader David Ben-Gurion. As of Saturday, Netanyahu has spent 4,876 days – more than 13 years – in office. Netanyahu won his first election in 1996, becoming Israel's youngest-ever Prime Minister at the age of 46.",world,"Benjamin Netanyahu becomes longest-serving Israeli PM. Benjamin Netanyahu has become Israel's longest-serving Prime Minister, surpassing the record set by the country's founding father and first leader David Ben-Gurion. As of Saturday, Netanyahu has spent 4,876 days – more than 13 years – in office. Netanyahu won his first election in 1996, becoming Israel's youngest-ever Prime Minister at the age of 46.",benjamin netanyahu become longest serve israeli pm benjamin netanyahu become israel longest serve prime minister surpass record set country found father first leader david ben gurion saturday netanyahu spend day year office netanyahu win first election become israel youngest ever prime minister age
Netherlands 10% liable for Srebrenica massacre: Supreme Court,"The Netherlands' Supreme Court has ruled that the state is 10% liable for the deaths of 350 Bosnian Muslim men in the Srebrenica massacre in 1995. Dutch UN peacekeepers evacuated the men from their military base near Srebrenica despite knowing that they ""were in serious jeopardy"", the court said. Bosnian Serb forces killed 8,000 Muslim men in Srebrenica in 1995.",world,"Netherlands 10% liable for Srebrenica massacre: Supreme Court. The Netherlands' Supreme Court has ruled that the state is 10% liable for the deaths of 350 Bosnian Muslim men in the Srebrenica massacre in 1995. Dutch UN peacekeepers evacuated the men from their military base near Srebrenica despite knowing that they ""were in serious jeopardy"", the court said. Bosnian Serb forces killed 8,000 Muslim men in Srebrenica in 1995.",netherland liable srebrenica massacre supreme court netherland supreme court rule state liable death bosnian muslim man srebrenica massacre dutch un peacekeeper evacuate man military base near srebrenica despite know serious jeopardy court say bosnian serb force kill muslim man srebrenica
Virgin Orbit to launch small satellites for UK military,"Virgin Orbit, the small satellite launching arm of billionaire Richard Branson's spaceflight firm Virgin Galactic, has signed an initial agreement to develop small satellite launch capabilities for the UK's Royal Air Force (RAF). Virgin Orbit aims​ to launch hardware provided by UK-based Surrey Satellites in a demo mission. The deal is part of RAF's Artemis mission.",world,"Virgin Orbit to launch small satellites for UK military. Virgin Orbit, the small satellite launching arm of billionaire Richard Branson's spaceflight firm Virgin Galactic, has signed an initial agreement to develop small satellite launch capabilities for the UK's Royal Air Force (RAF). Virgin Orbit aims​ to launch hardware provided by UK-based Surrey Satellites in a demo mission. The deal is part of RAF's Artemis mission.",virgin orbit launch small satellite uk military virgin orbit small satellite launch arm billionaire richard branson spaceflight firm virgin galactic sign initial agreement develop small satellite launch capability uks royal air force raf virgin orbit aim launch hardware provide uk base surrey satellite demo mission deal part rafs artemis mission
"US authorises deployment of troops, resources to Saudi Arabia","Acting US Defence Secretary Richard Spencer has authorised the deployment of US military personnel and resources to Saudi Arabia, the Pentagon said on Friday. It added that the move would provide an ""additional deterrent"" in the face of ""emergent, credible threats"". Saudi previously said it had approved hosting US forces to boost regional security and stability.",world,"US authorises deployment of troops, resources to Saudi Arabia. Acting US Defence Secretary Richard Spencer has authorised the deployment of US military personnel and resources to Saudi Arabia, the Pentagon said on Friday. It added that the move would provide an ""additional deterrent"" in the face of ""emergent, credible threats"". Saudi previously said it had approved hosting US forces to boost regional security and stability.",us authorise deployment troop resource saudi arabia act us defence secretary richard spencer authorise deployment us military personnel resource saudi arabia pentagon say friday add move would provide additional deterrent face emergent credible threat saudi previously say approve host us force boost regional security stability
NZ PM returns home on commercial flight as her plane breaks down,"New Zealand Prime Minister Jacinda Ardern was forced to fly home on a commercial flight on Friday after a technical snag hit her air force plane, following a two-day trip to Australia. In 2016, the then PM John Key had to delay a visit to India after his plane broke down on a refuelling stop in the north of Australia.",world,"NZ PM returns home on commercial flight as her plane breaks down. New Zealand Prime Minister Jacinda Ardern was forced to fly home on a commercial flight on Friday after a technical snag hit her air force plane, following a two-day trip to Australia. In 2016, the then PM John Key had to delay a visit to India after his plane broke down on a refuelling stop in the north of Australia.",nz pm return home commercial flight plane break new zealand prime minister jacinda ardern force fly home commercial flight friday technical snag hit air force plane follow two day trip australia pm john key delay visit india plane break refuelling stop north australia
